{
  "required" : true ,
  "$schema" : "http://json-schema.org/draft-03/schema" ,
  "type" : "object" ,
  "properties" : {
    "sid" : {
      "type" : "string" ,
      "required" : false
    } ,
    "account_sid" : {
      "type" : "string" ,
      "required" : false
    } ,
    "parent_sid" : {
      "type" : "string" ,
      "required" : false
    } ,
    "content-type" : {
      "type" : "string" ,
      "required" : false
    } ,
    "date_created" : {
      "type" : "string" ,
      "required" : false
    } ,
    "date_updated" : {
      "type" : "string" ,
      "required" : false
    } ,
    "uri" : {
      "type" : "string" ,
      "required" : false
    }
  }
}